Kategorie,Název (CZ),Název (EN),Název (IT),Cena
soup,Tomátová polévka s mascarpone,Tomato soup with mascarpone,Zuppa di pomodoro con mascarpone,75 Kč
starter,Burrata s cherry rajčaty bazalkou a balsamicem,Burrata with cherry tomatoes basil and balsamic,Burrata con pomodorini basilico e balsamico,210 Kč
starter,Sušená šunka s cantalupe melounem,Cured ham with cantaloupe melon,Prosciutto crudo con melone cantalupo,210 Kč
main,Rigatoni s pražskou šunkou rukolou,Rigatoni with Prague ham and arugula,Rigatoni con prosciutto cotto e rucola,245 Kč
main,Pizza Tartufo,Pizza Tartufo,Pizza Tartufo,420 Kč
main,Telecí saltimbocca s grenaille a hlívou,Veal saltimbocca with grenaille and oyster mushroom,Saltimbocca di vitello con grenaille e pleurotus,385 Kč
dessert,Carpaccio z ananasu s citronellem a červeným pepřem,Pineapple carpaccio with lemongrass and red pepper,Carpaccio di ananas con citronella e pepe rosso,165 Kč
